{
  "reported_at": "2026-09-30T14:00:05+00:00",
  "manifest_schema": null,
  "theme_id": null,
  "current_work_id": null,
  "announced_content_id": null,
  "television_reachable": null,
  "television_showing_art": null,
  "has_label_surface": false,
  "label_surface_working": null,
  "last_error": null
}
