{
  "reported_at": "2026-09-30T14:00:05+00:00",
  "manifest_schema": "1.1",
  "theme_id": "th-surrealism",
  "current_work_id": "w-dali-1",
  "announced_content_id": "MY_F0042",
  "television_reachable": true,
  "television_showing_art": true,
  "has_label_surface": true,
  "label_surface_working": true,
  "last_error": null
}
